{
  "api_version": "agent-platform/v1alpha1",
  "kind": "ModelPolicy",
  "metadata": {
    "id": "mpo_0198f6d0-7ef0-7b0e-a0d3-5f9c96c7f411",
    "key": "development-model-policy",
    "namespace": "development",
    "version": "1.0.0",
    "revision": 1,
    "scope": {
      "type": "tenant",
      "tenant_id": "ten_0198f6d0-7ef0-7b0e-a0d3-5f9c96c7f411"
    },
    "labels": {
      "domain": "development"
    },
    "annotations": {},
    "content_digest": "sha256:a1b2c3d4e5f6a1b2c3d4e5f6a1b2c3d4e5f6a1b2c3d4e5f6a1b2c3d4e5f6a1b2",
    "created_at": "2026-09-01T00:00:00Z",
    "created_by": {
      "actor_type": "user",
      "actor_id": "usr_0198f6d0-7ef0-7b0e-a0d3-5f9c96c7f411",
      "tenant_id": "ten_0198f6d0-7ef0-7b0e-a0d3-5f9c96c7f411"
    }
  },
  "spec": {
    "routes": [
      {
        "route_id": "openai-gpt4",
        "provider": "openai",
        "model": "gpt-4-turbo",
        "priority": 100,
        "required_capabilities": ["tool_calling", "structured_output", "reasoning"],
        "conditions": {
          "task_type": ["complex", "standard"]
        }
      },
      {
        "route_id": "anthropic-claude",
        "provider": "anthropic",
        "model": "claude-3-sonnet",
        "priority": 90,
        "required_capabilities": ["tool_calling", "structured_output"],
        "conditions": {
          "task_type": ["standard"]
        }
      }
    ],
    "required_capabilities": ["tool_calling", "structured_output"],
    "provider_allowlist": ["openai", "anthropic"],
    "data_classification_rules": [
      {
        "classification": "public",
        "allowed_providers": ["openai", "anthropic"],
        "require_local": false
      },
      {
        "classification": "internal",
        "allowed_providers": ["openai", "anthropic"],
        "require_local": false
      },
      {
        "classification": "confidential",
        "allowed_providers": ["anthropic"],
        "require_local": false
      },
      {
        "classification": "restricted",
        "allowed_providers": [],
        "require_local": true
      }
    ],
    "fallback_chain": [
      {
        "route_id": "anthropic-claude",
        "on_error_codes": ["RATE_LIMITED", "TIMEOUT", "MODEL_ERROR"]
      }
    ],
    "budget_limits": {
      "max_wall_time_seconds": 3600,
      "max_model_tokens": 400000,
      "max_cost_usd": "20.00",
      "max_tool_calls": 100,
      "max_iterations": 20
    },
    "quality_floor": "standard",
    "region_constraints": ["US", "EU"],
    "local_model_rules": {
      "enabled": false
    },
    "circuit_breaker": {
      "failure_threshold": 5,
      "window_seconds": 60,
      "open_seconds": 300
    }
  },
  "status": {
    "phase": "active",
    "observed_revision": 1,
    "activated_at": "2026-09-01T00:00:00Z"
  }
}
